### ISSUE TITLE
GNS3 VPN issue

### ISSUE THREAD

**Issue by jcalano** [GNS3/gns3-vm#194]
Unable to ping across Wireguard site-to-site VPN.

---

### Environment

* **Local PC**

  * OS: Linux Mint
  * IP: `192.168.28.97`
  * GNS3 GUI + GNS3 server (local compute)
  * uBridge 0.9.19, libpcap 1.10.4
  
* **Remote servers (Site2)**

  * `gns3server1` – IP `192.168.6.10`, GNS3 2.2.55, server config at `/opt/gns3/server/gns3_server.conf`
  * `gns3server2` – IP `192.168.6.11`, GNS3 2.2.55, server config at `/opt/gns3/server/gns3_server.conf`
  
* **Routing between sites**

  * Site-to-site WireGuard between two pfSense boxes
  * Site2 WG IP: `192.168.255.1`
  * Site1 WG IP: `192.168.255.2`
  * Static routes:

    * On Site2: `192.168.28.0/24 → 192.168.255.2`
    * On Site1: `192.168.6.0/24 → 192.168.255.1`

---

### Symptom

* Any lab running **only on one server** works fine:

  * Router on `gns3server1` ↔ router on `gns3server2` → ping OK.
  * Two routers on `gns3server2` → ping OK.
  * Two routers on **local Mint** → ping OK.
* **Only this fails:**

  * A router on **local Mint** cannot ping any router on `gns3server1` or `gns3server2`.
* In a minimal test:

  * Router `Site1` on Mint (Gi0/0 `10.0.0.1/24`)
  * Router `Site2` on `gns3server2` (Gi0/0 `10.0.0.2/24`)
  * Single link Gi0/0 ↔ Gi0/0
    => `ping 10.0.0.2` from `Site1` **never succeeds**.

---

#### 1. Changed GNS3 server configs (host/IP)

* Initially, both Site2 servers advertised the host IP 127.0.0.1.

* I located their configs at:

  ```
  /opt/gns3/server/gns3_server.conf
  ```

* Updated them so each server’s `[Server]` section has the correct own IP:

  ```
  # gns3server1
  [Server]
  host = 192.168.6.10
  port = 3080
  protocol = http
  enable_ssl = False
  auth = True

  # gns3server2
  [Server]
  host = 192.168.6.11
  port = 3080
  protocol = http
  enable_ssl = False
  auth = True
  ```

* Verified from Mint:

  ```
  curl -v http://192.168.6.10:3080/v2/version
  curl -v http://192.168.6.11:3080/v2/version
  ```

  Both returned `HTTP/1.1 200 OK` with version `2.2.55`.

* Local server config on Mint (via GUI and config file) is:

  ```
  [Server]
  host = 192.168.28.97
  port = 3080
  udp_start_port_range = 10000
  udp_end_port_range   = 20000
  protocol = http
  enable_ssl = False
  auth = True
  ```

#### 2. Verified multi-server connectivity at the OS level

* From Mint to each server and vice versa:

  * `ping` between `192.168.28.97` and `192.168.6.10/.11` → OK.
  * `curl /v2/version` to each GNS3 server from each side → OK.
  
* Confirmed routing via WireGuard:

  * pfSense configs on both sides show static routes and “allow all” rules on LAN and WG interfaces.
  * No pf or UFW rules specifically blocking UDP 10000–20000.

#### 3. Proved UDP tunnels work end-to-end

* **Manual test Mint → gns3server2:**

  On Mint:

  ```
  sudo tcpdump -ni any udp port 15000
  echo "test" | nc -u 192.168.6.11 15000
  ```

  → Saw `192.168.28.97.x > 192.168.6.11.15000` on Mint.

* **On Site1 pfSense (tun_wg0):**

  ```
  tcpdump -ni tun_wg0 udp port 15000
  ```

  → Saw `192.168.255.2.1500 > 192.168.6.11.15000`.

* **On gns3server2 (eth0):**

  ```
  sudo tcpdump -ni eth0 udp port 15000
  ```

  → Saw the same packet arrive as `192.168.255.2.x > 192.168.6.11.15000`.

* **Reverse direction (gns3server2 → Mint)** showed the mirror behavior.

Conclusion: **UDP is working in both directions between Mint and Site2 across WireGuard and pfSense.**

#### 4. Watched actual GNS3 NIO-UDP flows

With the minimal `Site1` (Mint) ↔ `Site2` (server2) lab running and pinging:

* On `gns3server2`:

  ```
  sudo tcpdump -ni eth0 udp and host 192.168.28.97 and portrange 10000-20000
  ```

  Example output:

  ```
  IP 192.168.6.11.20000 > 192.168.28.97.10000: UDP, length 350
  IP 192.168.6.11.20001 > 192.168.28.97.10001: UDP, length 60
  ```

* On Mint:

  ```
  sudo tcpdump -ni any udp and host 192.168.6.11 and portrange 10000-20000
  ```

  Saw the reverse:

  ```
  IP 192.168.28.97.10001 > 192.168.6.11.20001: UDP, length 60
  ```

So **GNS3 is definitely sending NIO-UDP between 192.168.28.97 and 192.168.6.11** in both directions for the lab link.

#### 5. Captured on the *GNS3 link itself*

I then captured directly on the logical link between `Site1` and `Site2` (Wireshark capture started from the GNS3 GUI with right-click → Start capture).

The capture contents:

* Repeated ARP requests:

  ```
  ARP, Request who-has 10.0.0.2 tell 10.0.0.1
  ```

* **No ARP replies** from 10.0.0.2.

* No ICMP traffic at all.

At the same time, on both routers:

```
Site1#sh ip int brief
Gi0/0 10.0.0.1 up up

Site2#sh ip int brief
Gi0/0 10.0.0.2 up up
```

So on the virtual wire:

> `Site1`’s ARP frames are not arriving at `Site2`’s Gi0/0, even though the host NIO-UDP tunnel is active.

#### 6. Cross-server vs local-server behavior matrix

I tested different placements:

* **gns3server2 ↔ gns3server2 (both routers on server2)**
  → Pings fine.

* **gns3server1 ↔ gns3server2**
  → Pings fine.

* **Mint ↔ Mint (both routers on local server)**
  → Pings fine.

* **Mint ↔ gns3server1**
  → Fails (same one-way ARP symptom).

* **Mint ↔ gns3server2**
  → Fails (one-way ARP).

That strongly suggests the issue is **specific to multi-server links involving the special “local server” on Mint**, not the remote servers or the network.

#### 7. uBridge / capture error on Mint (may be related)

When adding a GNS3 Cloud linked to the physical NIC and starting a capture on that link, I see on the local server:

```
Error while sending command 'bridge start_capture ...': Unknown module 'bridge':
uBridge version 0.9.19 running with libpcap 1.10.4 (with TPACKET_V3)
...
Destination NIO listener thread ... stopped because of an error: Message too long
```

This only appears on **Mint**, not on the remote servers.
It points to a possible mismatch or issue with the local uBridge / capture support compared to what the GNS3 controller expects.

---

### Current state / hypothesis

* Networking between sites (WireGuard + pfSense) is confirmed good.
* All three GNS3 servers are reachable and correctly advertise their own IPs.
* NIO-UDP tunnels between Mint and Site2 are up and carrying data in both directions.
* Multi-server labs work **remote↔remote** but not **local↔remote**, even though the UDP layer is fine.
* Capture on the logical link shows **only ARP from the local router**, no replies from the remote router, implying the remote compute never receives those frames on its interface.
* Local uBridge on Mint reports `Unknown module 'bridge'` during captures, suggesting its integration with the local “special” server may be off.

So the working theory is:

> There’s a GNS3 bug or mismatch affecting multi-server links that involve the **local compute on Mint**, while links between **remote computes** work correctly.

---
I ran some captures on the firewalls, my pc, and server2.  results are below. 

Site1 fw
18:45:06.990430 IP 192.168.28.97.10001 > 192.168.6.11.20001: UDP, length 60
18:45:08.990185 IP 192.168.28.97.10001 > 192.168.6.11.20001: UDP, length 60
18:45:10.989917 IP 192.168.28.97.10001 > 192.168.6.11.20001: UDP, length 60
18:45:12.989513 IP 192.168.28.97.10001 > 192.168.6.11.20001: UDP, length 60
18:45:14.989339 IP 192.168.28.97.10001 > 192.168.6.11.20001: UDP, length 60
18:45:15.445208 IP 192.168.28.97.10001 > 192.168.6.11.20001: UDP, length 60
18:45:16.989042 IP 192.168.28.97.10001 > 192.168.6.11.20001: UDP, length 60
18:45:18.988722 IP 192.168.28.97.10001 > 192.168.6.11.20001: UDP, length 60

Site2 fw
18:44:24.746186 IP 192.168.6.11.20001 > 192.168.28.97.10001: UDP, length 60
18:44:27.510557 IP 192.168.6.11.20001 > 192.168.28.97.10001: UDP, length 400
18:44:34.752329 IP 192.168.6.11.20001 > 192.168.28.97.10001: UDP, length 60
18:44:44.761292 IP 192.168.6.11.20001 > 192.168.28.97.10001: UDP, length 60
18:44:54.763468 IP 192.168.6.11.20001 > 192.168.28.97.10001: UDP, length 60
18:45:04.765271 IP 192.168.6.11.20001 > 192.168.28.97.10001: UDP, length 60
18:45:14.766522 IP 192.168.6.11.20001 > 192.168.28.97.10001: UDP, length 60
18:45:18.009568 IP 192.168.6.11.20001 > 192.168.28.97.10001: UDP, length 400

mint
18:45:04.796181 enp5s0 Out IP 192.168.28.97.10001 > 192.168.6.11.20001: UDP, length 60
18:45:05.252077 enp5s0 Out IP 192.168.28.97.10001 > 192.168.6.11.20001: UDP, length 60
18:45:06.795919 enp5s0 Out IP 192.168.28.97.10001 > 192.168.6.11.20001: UDP, length 60
18:45:08.795570 enp5s0 Out IP 192.168.28.97.10001 > 192.168.6.11.20001: UDP, length 60
18:45:10.795301 enp5s0 Out IP 192.168.28.97.10001 > 192.168.6.11.20001: UDP, length 60
18:45:12.794965 enp5s0 Out IP 192.168.28.97.10001 > 192.168.6.11.20001: UDP, length 60
18:45:14.794688 enp5s0 Out IP 192.168.28.97.10001 > 192.168.6.11.20001: UDP, length 60
18:45:15.250567 enp5s0 Out IP 192.168.28.97.10001 > 192.168.6.11.20001: UDP, length 60
18:45:16.794401 enp5s0 Out IP 192.168.28.97.10001 > 192.168.6.11.20001: UDP, length 60
18:45:18.794083 enp5s0 Out IP 192.168.28.97.10001 > 192.168.6.11.20001: UDP, length 60
18:45:20.793730 enp5s0 Out IP 192.168.28.97.10001 > 192.168.6.11.20001: UDP, length 60

server2
01:44:14.750597 eth0  Out IP 192.168.6.11.20001 > 192.168.28.97.10001: UDP, length 60
01:44:24.752877 eth0  Out IP 192.168.6.11.20001 > 192.168.28.97.10001: UDP, length 60
01:44:27.517195 eth0  Out IP 192.168.6.11.20001 > 192.168.28.97.10001: UDP, length 400
01:44:34.758964 eth0  Out IP 192.168.6.11.20001 > 192.168.28.97.10001: UDP, length 60
01:44:44.767986 eth0  Out IP 192.168.6.11.20001 > 192.168.28.97.10001: UDP, length 60
01:44:54.770148 eth0  Out IP 192.168.6.11.20001 > 192.168.28.97.10001: UDP, length 60
01:45:04.771979 eth0  Out IP 192.168.6.11.20001 > 192.168.28.97.10001: UDP, length 60
01:45:14.773294 eth0  Out IP 192.168.6.11.20001 > 192.168.28.97.10001: UDP, length 60
01:45:18.016325 eth0  Out IP 192.168.6.11.20001 > 192.168.28.97.10001: UDP, length 400

**Comment by jcalano** [comment]
[Wireshark.json](https://github.com/user-attachments/files/23697266/Wireshark.json)

<img width="850" height="582" alt="Image" src="https://github.com/user-attachments/assets/44013ac8-0166-4079-b841-417a871f2cac" />

**Comment by jcalano** [comment]
Issue resolved by replacing malfunctioning firewall.  Please feel free to close this ticket.

Thank you.
